{
  "schemaVersion": "4.0.0",
  "recordType": "feature_vector",
  "recordId": "feature-example",
  "createdAt": "2026-07-24T00:00:00Z",
  "status": "BLOCKED",
  "provenance": {},
  "canonicalPlayerId": null,
  "scope": {},
  "engineId": null,
  "roleId": null,
  "features": {},
  "inputMetricIds": [],
  "benchmarkRefs": [],
  "sampleReliability": {}
}
